{"dataset":"l2-metrics","api_version":"v1","schema_version":"1.1.0","schema_url":"https://blockchains.github.io/blockchainlab-api/v1/schemas/l2-metrics.schema.json","description":"Ethereum L2/L3 scaling projects: stage, category, stack, risk summary and Total Value Secured breakdown. From L2BEAT.","generated_at":"2026-10-29T10:01:33.970Z","source":"L2BEAT public API","source_url":"https://l2beat.com/api/scaling/summary","built_by":"Blockchain Lab — https://blockchainlab.com","licence_note":"Data belongs to the named source; check its terms before reuse. Attribute the source and Blockchain Lab.","count":94,"data":[{"id":"base","name":"Base Chain","type":"layer2","host_chain":"Ethereum","category":"Optimistic Rollup","stack":["OP Stack"],"purposes":["Universal"],"stage":"Stage 1","under_review":false,"tvs_usd":14734450688,"tvs_breakdown":{"native":7119021712,"canonical":2714011403,"external":4901419629,"ether":2230785010,"stablecoin":4715145450,"btc":4033962176},"tvs_change_7d_pct":-5.021,"risks":[{"name":"Sequencer Failure","value":"Self sequence","sentiment":"good"},{"name":"State Validation","value":"Fraud proofs (1R, ZK)","sentiment":"good"},{"name":"Data Availability","value":"Onchain","sentiment":"good"},{"name":"Exit Window","value":"None","sentiment":"bad"},{"name":"Proposer Failure","value":"Self propose","sentiment":"good"}],"l2beat_url":"https://l2beat.com/scaling/projects/base"},{"id":"arbitrum","name":"Arbitrum One","type":"layer2","host_chain":"Ethereum","category":"Optimistic Rollup","stack":["Arbitrum"],"purposes":["Universal"],"stage":"Stage 1","under_review":false,"tvs_usd":9580750848,"tvs_breakdown":{"native":2412074060,"canonical":3237447848,"external":3931236194,"ether":2062530195,"stablecoin":4009185573,"btc":699557724},"tvs_change_7d_pct":-6.168,"risks":[{"name":"Sequencer Failure","value":"Self sequence","sentiment":"good"},{"name":"State Validation","value":"Fraud proofs (INT)","sentiment":"good"},{"name":"Data Availability","value":"Onchain","sentiment":"good"},{"name":"Exit Window","value":"None","sentiment":"bad"},{"name":"Proposer Failure","value":"Self propose","sentiment":"good"}],"l2beat_url":"https://l2beat.com/scaling/projects/arbitrum"},{"id":"hyperliquid","name":"Hyperliquid","type":"layer3","host_chain":"Arbitrum One","category":"Other","stack":[],"purposes":["Exchange"],"stage":"Not applicable","under_review":false,"tvs_usd":6612116480,"tvs_breakdown":{"native":0,"canonical":6612116480,"external":0,"ether":0,"stablecoin":6612116480,"btc":0},"tvs_change_7d_pct":-2.277,"risks":[{"name":"Sequencer Failure","value":"No mechanism","sentiment":"bad"},{"name":"State Validation","value":"None","sentiment":"bad"},{"name":"Data Availability","value":"External","sentiment":"bad"},{"name":"Exit Window","value":"None","sentiment":"bad"},{"name":"Proposer Failure","value":"Cannot withdraw","sentiment":"bad"}],"l2beat_url":"https://l2beat.com/scaling/projects/hyperliquid"},{"id":"polygon-pos","name":"Polygon PoS","type":"layer2","host_chain":"Ethereum","category":"Other","stack":[],"purposes":["Universal"],"stage":"Not applicable","under_review":false,"tvs_usd":3893047808,"tvs_breakdown":{"native":242872174,"canonical":2288766796,"external":1361409248,"ether":224408623,"stablecoin":2915229824,"btc":154425814},"tvs_change_7d_pct":2.177,"risks":[{"name":"Sequencer Failure","value":"Decentralized Sequencer Set","sentiment":"warning"},{"name":"State Validation","value":"None","sentiment":"bad"},{"name":"Data Availability","value":"PoS network","sentiment":"warning"},{"name":"Exit Window","value":"None","sentiment":"bad"},{"name":"Proposer Failure","value":"Cannot withdraw","sentiment":"warning"}],"l2beat_url":"https://l2beat.com/scaling/projects/polygon-pos"},{"id":"robinhood","name":"Robinhood Chain","type":"layer2","host_chain":"Ethereum","category":"Other","stack":["Arbitrum"],"purposes":["Universal","RWA"],"stage":"Stage 0","under_review":false,"tvs_usd":2309632000,"tvs_breakdown":{"native":512509898,"canonical":605523814,"external":1191598681,"ether":600736571,"stablecoin":1189474235,"btc":0},"tvs_change_7d_pct":-3.325,"risks":[{"name":"Sequencer Failure","value":"No mechanism","sentiment":"bad"},{"name":"State Validation","value":"Fraud proofs (INT)","sentiment":"bad"},{"name":"Data Availability","value":"Onchain","sentiment":"good"},{"name":"Exit Window","value":"None","sentiment":"bad"},{"name":"Proposer Failure","value":"Self propose","sentiment":"good"}],"l2beat_url":"https://l2beat.com/scaling/projects/robinhood"},{"id":"optimism","name":"OP Mainnet","type":"layer2","host_chain":"Ethereum","category":"Optimistic Rollup","stack":["OP Stack"],"purposes":["Universal"],"stage":"Stage 1","under_review":false,"tvs_usd":1633655040,"tvs_breakdown":{"native":301438123,"canonical":1023920935,"external":308296093,"ether":535989811,"stablecoin":462682161,"btc":63122653},"tvs_change_7d_pct":-17.659,"risks":[{"name":"Sequencer Failure","value":"Self sequence","sentiment":"good"},{"name":"State Validation","value":"Fraud proofs (INT)","sentiment":"good"},{"name":"Data Availability","value":"Onchain","sentiment":"good"},{"name":"Exit Window","value":"None","sentiment":"bad"},{"name":"Proposer Failure","value":"Self propose","sentiment":"good"}],"l2beat_url":"https://l2beat.com/scaling/projects/op-mainnet"},{"id":"mantle","name":"Mantle","type":"layer2","host_chain":"Ethereum","category":"ZK Rollup","stack":["OP Stack"],"purposes":["Universal"],"stage":"Stage 0","under_review":false,"tvs_usd":1283920896,"tvs_breakdown":{"native":30379165,"canonical":614888078,"external":638653917,"ether":412440960,"stablecoin":634149443,"btc":12699728},"tvs_change_7d_pct":-3.379,"risks":[{"name":"Sequencer Failure","value":"Self sequence","sentiment":"good"},{"name":"State Validation","value":"Validity proofs (ST, SN)","sentiment":"good"},{"name":"Data Availability","value":"Onchain","sentiment":"good"},{"name":"Exit Window","value":"None","sentiment":"bad"},{"name":"Proposer Failure","value":"Cannot withdraw","sentiment":"bad"}],"l2beat_url":"https://l2beat.com/scaling/projects/mantle"},{"id":"lighter","name":"Lighter","type":"layer2","host_chain":"Ethereum","category":"ZK Rollup","stack":[],"purposes":["Exchange"],"stage":"Stage 0","under_review":true,"tvs_usd":1017370368,"tvs_breakdown":{"native":0,"canonical":1017370344,"external":0,"ether":22215302,"stablecoin":571190592,"btc":0},"tvs_change_7d_pct":-13.915,"risks":[{"name":"Sequencer Failure","value":"Force via L1","sentiment":"good"},{"name":"State Validation","value":"Validity proofs (SN)","sentiment":"good"},{"name":"Data Availability","value":"Onchain (SD)","sentiment":"good"},{"name":"Exit Window","value":"None","sentiment":"bad"},{"name":"Proposer Failure","value":"Use escape hatch","sentiment":"good"}],"l2beat_url":"https://l2beat.com/scaling/projects/lighter"},{"id":"worldchain","name":"World Chain","type":"layer2","host_chain":"Ethereum","category":"Other","stack":["OP Stack"],"purposes":["Universal","Identity"],"stage":"Stage 0","under_review":false,"tvs_usd":380708704,"tvs_breakdown":{"native":0,"canonical":364059560,"external":16649148,"ether":14806158,"stablecoin":18421460,"btc":10503894},"tvs_change_7d_pct":-22.041,"risks":[{"name":"Sequencer Failure","value":"Self sequence","sentiment":"good"},{"name":"State Validation","value":"Fraud proofs (INT)","sentiment":"bad"},{"name":"Data Availability","value":"Onchain","sentiment":"good"},{"name":"Exit Window","value":"None","sentiment":"bad"},{"name":"Proposer Failure","value":"Cannot withdraw","sentiment":"bad"}],"l2beat_url":"https://l2beat.com/scaling/projects/world"},{"id":"starknet","name":"Starknet","type":"layer2","host_chain":"Ethereum","category":"ZK Rollup","stack":["SN Stack"],"purposes":["Universal"],"stage":"Stage 1","under_review":false,"tvs_usd":364851968,"tvs_breakdown":{"native":29052196,"canonical":256792108,"external":79007637,"ether":41171303,"stablecoin":38460725,"btc":76831090},"tvs_change_7d_pct":-28.716,"risks":[{"name":"Sequencer Failure","value":"Log via L1","sentiment":"warning"},{"name":"State Validation","value":"Validity proofs (ST)","sentiment":"good"},{"name":"Data Availability","value":"Onchain (SD)","sentiment":"good"},{"name":"Exit Window","value":"None","sentiment":"bad"},{"name":"Proposer Failure","value":"Security Council minority","sentiment":"warning"}],"l2beat_url":"https://l2beat.com/scaling/projects/starknet"},{"id":"ink","name":"Ink","type":"layer2","host_chain":"Ethereum","category":"Optimistic Rollup","stack":["OP Stack"],"purposes":["Universal"],"stage":"Stage 1","under_review":false,"tvs_usd":361543488,"tvs_breakdown":{"native":0,"canonical":53205284,"external":308338231,"ether":53205283,"stablecoin":153772072,"btc":154566160},"tvs_change_7d_pct":-5.175,"risks":[{"name":"Sequencer Failure","value":"Self sequence","sentiment":"good"},{"name":"State Validation","value":"Fraud proofs (INT)","sentiment":"good"},{"name":"Data Availability","value":"Onchain","sentiment":"good"},{"name":"Exit Window","value":"None","sentiment":"bad"},{"name":"Proposer Failure","value":"Self propose","sentiment":"good"}],"l2beat_url":"https://l2beat.com/scaling/projects/ink"},{"id":"linea","name":"Linea","type":"layer2","host_chain":"Ethereum","category":"ZK Rollup","stack":[],"purposes":["Universal"],"stage":"Stage 0","under_review":false,"tvs_usd":331467008,"tvs_breakdown":{"native":1458279,"canonical":116505006,"external":213503696,"ether":235854735,"stablecoin":31025860,"btc":2884212},"tvs_change_7d_pct":-5.244,"risks":[{"name":"Sequencer Failure","value":"No mechanism","sentiment":"bad"},{"name":"State Validation","value":"Validity proofs (SN)","sentiment":"good"},{"name":"Data Availability","value":"Onchain","sentiment":"good"},{"name":"Exit Window","value":"None","sentiment":"bad"},{"name":"Proposer Failure","value":"Cannot withdraw","sentiment":"bad"}],"l2beat_url":"https://l2beat.com/scaling/projects/linea"},{"id":"gnosis","name":"Gnosis Chain","type":"layer2","host_ch